{
  "schema_version": "5.1",
  "kind": "cast",
  "lineage": {
    "story": "e3b8137da419de67c4186062115e2e610d930622585b7e30f08deee7f996748b"
  },
  "characters": [
    {
      "character_id": "CHAR_A",
      "name": {
        "cn": "顾言川",
        "en": "Gu Yanchuan"
      },
      "identity": {
        "cn": "约28岁的成年人，保持原面部和身材比例",
        "en": "an adult approximately 28 years old with consistent facial features and body proportions"
      },
      "hairstyle": {
        "cn": "整齐的黑发",
        "en": "neatly styled black hair"
      },
      "default_wardrobe": "OFFICE",
      "hair_state": "dry",
      "wardrobes": {
        "OFFICE": {
          "description": {
            "cn": "黑色通勤西装",
            "en": "a black office suit"
          },
          "runtime_asset_id": "CHAR_A_H3_OFFICE"
        }
      }
    },
    {
      "character_id": "CHAR_B",
      "name": {
        "cn": "林晚晴",
        "en": "Lin Wanqing"
      },
      "identity": {
        "cn": "约28岁的成年人，保持原面部和身材比例",
        "en": "an adult approximately 28 years old with consistent facial features and body proportions"
      },
      "hairstyle": {
        "cn": "整齐的黑发",
        "en": "neatly styled black hair"
      },
      "default_wardrobe": "OFFICE",
      "hair_state": "dry",
      "wardrobes": {
        "OFFICE": {
          "description": {
            "cn": "黑色通勤西装",
            "en": "a black office suit"
          },
          "runtime_asset_id": "CHAR_B_H3_OFFICE"
        }
      }
    },
    {
      "character_id": "CHAR_C",
      "name": {
        "cn": "陈悦",
        "en": "Chen Yue"
      },
      "identity": {
        "cn": "约28岁的成年人，保持原面部和身材比例",
        "en": "an adult approximately 28 years old with consistent facial features and body proportions"
      },
      "hairstyle": {
        "cn": "整齐的黑发",
        "en": "neatly styled black hair"
      },
      "default_wardrobe": "OFFICE",
      "hair_state": "dry",
      "wardrobes": {
        "OFFICE": {
          "description": {
            "cn": "黑色通勤西装",
            "en": "a black office suit"
          },
          "runtime_asset_id": "CHAR_C_H3_OFFICE"
        }
      }
    },
    {
      "character_id": "CHAR_D",
      "name": {
        "cn": "周明",
        "en": "Zhou Ming"
      },
      "identity": {
        "cn": "约28岁的成年人，保持原面部和身材比例",
        "en": "an adult approximately 28 years old with consistent facial features and body proportions"
      },
      "hairstyle": {
        "cn": "整齐的黑发",
        "en": "neatly styled black hair"
      },
      "default_wardrobe": "OFFICE",
      "hair_state": "dry",
      "wardrobes": {
        "OFFICE": {
          "description": {
            "cn": "黑色通勤西装",
            "en": "a black office suit"
          },
          "runtime_asset_id": "CHAR_D_H3_OFFICE"
        }
      }
    },
    {
      "character_id": "CHAR_E",
      "name": {
        "cn": "苏岚",
        "en": "Su Lan"
      },
      "identity": {
        "cn": "约28岁的成年人，保持原面部和身材比例",
        "en": "an adult approximately 28 years old with consistent facial features and body proportions"
      },
      "hairstyle": {
        "cn": "整齐的黑发",
        "en": "neatly styled black hair"
      },
      "default_wardrobe": "OFFICE",
      "hair_state": "dry",
      "wardrobes": {
        "OFFICE": {
          "description": {
            "cn": "黑色通勤西装",
            "en": "a black office suit"
          },
          "runtime_asset_id": "CHAR_E_H3_OFFICE"
        }
      }
    }
  ]
}
