{
  "schema_version": "5.1",
  "kind": "cast",
  "lineage": {
    "story": "47d3768d85e6af0f80440628afd1c8840b394a2aedaf7b758296672b5ed5c155"
  },
  "characters": [
    {
      "character_id": "CHAR_A",
      "name": {
        "cn": "顾言川",
        "en": "Gu Yanchuan"
      },
      "identity": {
        "cn": "约28岁的成年人，保持原面部和身材比例",
        "en": "an adult approximately 28 years old with consistent facial features and body proportions"
      },
      "hairstyle": {
        "cn": "整齐的黑发",
        "en": "neatly styled black hair"
      },
      "default_wardrobe": "OFFICE",
      "hair_state": "dry",
      "wardrobes": {
        "OFFICE": {
          "description": {
            "cn": "黑色通勤西装",
            "en": "a black office suit"
          },
          "runtime_asset_id": "CHAR_A_H3_OFFICE",
          "wardrobe_asset_id": "CHAR_A_WARDROBE_OFFICE"
        }
      },
      "master_asset_id": "CHAR_A_MASTER",
      "face4_asset_id": "CHAR_A_FACE4",
      "body_asset_id": "CHAR_A_BODY"
    },
    {
      "character_id": "CHAR_B",
      "name": {
        "cn": "林晚晴",
        "en": "Lin Wanqing"
      },
      "identity": {
        "cn": "约28岁的成年人，保持原面部和身材比例",
        "en": "an adult approximately 28 years old with consistent facial features and body proportions"
      },
      "hairstyle": {
        "cn": "整齐的黑发",
        "en": "neatly styled black hair"
      },
      "default_wardrobe": "OFFICE",
      "hair_state": "dry",
      "wardrobes": {
        "OFFICE": {
          "description": {
            "cn": "黑色通勤西装",
            "en": "a black office suit"
          },
          "runtime_asset_id": "CHAR_B_H3_OFFICE",
          "wardrobe_asset_id": "CHAR_B_WARDROBE_OFFICE"
        }
      },
      "master_asset_id": "CHAR_B_MASTER",
      "face4_asset_id": "CHAR_B_FACE4",
      "body_asset_id": "CHAR_B_BODY"
    }
  ]
}
